{
  "schema_version": "1.0",
  "generated": "2026-10-18T00:00:00+00:00",
  "synthetic": true,
  "folder": "oct-26",
  "settings": {
    "months": 24,
    "first": "2024-10",
    "last": "2026-09",
    "risk_free_rate": 0.04,
    "max_weight": 0.6,
    "usd_gbp": 0.75,
    "usd_gbp_source": "GBP=X.csv, 2026-09",
    "covariance": "shrunk",
    "target": "same-risk",
    "min_trade_gbp": 1.0
  },
  "people": [
    "person_1",
    "person_2"
  ],
  "total": {
    "value_gbp": 160265.61,
    "cash_gbp": 2956.17,
    "by_owner": {
      "person_1": 33644.67,
      "person_2": 126620.94
    },
    "starting_balance": 160266,
    "starting_balance_yaml": "starting_balance: 160266  # sbretire portfolio report: oct-26, 2026-10-17 to 2026-10-18"
  },
  "accounts": [
    {
      "id": "brokerage",
      "name": "Example brokerage",
      "provider": "schwab",
      "wrapper": "taxable",
      "owner": "person_1",
      "currency": "USD",
      "securities_gbp": 8718.75,
      "cash_gbp": 925.92,
      "value_gbp": 9644.67,
      "valuation_date": "2026-10-18",
      "date_assumed": false
    },
    {
      "id": "sipp_1",
      "name": "Example SIPP 1",
      "provider": "hl",
      "wrapper": "sipp",
      "owner": "person_1",
      "currency": "GBP",
      "securities_gbp": 23456.79,
      "cash_gbp": 543.21,
      "value_gbp": 24000.0,
      "valuation_date": "2026-10-17",
      "date_assumed": false
    },
    {
      "id": "isa",
      "name": "Example ISA",
      "provider": "vanguard",
      "wrapper": "isa",
      "owner": "person_2",
      "currency": "GBP",
      "securities_gbp": 20800.0,
      "cash_gbp": 0.0,
      "value_gbp": 20800.0,
      "valuation_date": "2026-10-17",
      "date_assumed": false
    },
    {
      "id": "pension",
      "name": "Example pension",
      "provider": "vanguard",
      "wrapper": "pension",
      "owner": "person_2",
      "currency": "GBP",
      "securities_gbp": 4210.9,
      "cash_gbp": 1000.03,
      "value_gbp": 5210.93,
      "valuation_date": "2026-10-17",
      "date_assumed": false
    },
    {
      "id": "sipp_2",
      "name": "Example SIPP 2",
      "provider": "ii",
      "wrapper": "sipp",
      "owner": "person_2",
      "currency": "GBP",
      "securities_gbp": 100123.0,
      "cash_gbp": 487.01,
      "value_gbp": 100610.01,
      "valuation_date": "2026-10-18",
      "date_assumed": true
    }
  ],
  "holdings": [
    {
      "ref": "sipp_2:EXA",
      "account": "sipp_2",
      "security_key": "EXA",
      "name": "Example World Momentum ETF $ Acc",
      "series": "momentum",
      "value_gbp": 60000.0,
      "weight": 0.37437850827760244,
      "return_ann": -0.11322099709115818,
      "volatility_ann": 0.1703965107145693,
      "sharpe": -0.850641186001379,
      "history_months": 24,
      "status": "full"
    },
    {
      "ref": "sipp_2:EXB",
      "account": "sipp_2",
      "security_key": "EXB",
      "name": "Example All-World ETF USD Acc GBP",
      "series": null,
      "value_gbp": 40123.0,
      "weight": 0.2503531481270374,
      "return_ann": null,
      "volatility_ann": null,
      "sharpe": null,
      "history_months": 0,
      "status": "missing"
    },
    {
      "ref": "isa:Example Strategy® 60% Fund - Accumulation",
      "account": "isa",
      "security_key": "Example Strategy® 60% Fund - Accumulation",
      "name": "Example Strategy® 60% Fund - Accumulation",
      "series": "strategy",
      "value_gbp": 20800.0,
      "weight": 0.12978454953623553,
      "return_ann": 0.010925318705590659,
      "volatility_ann": 0.06948989921738537,
      "sharpe": -0.3759051545550483,
      "history_months": 24,
      "status": "full"
    },
    {
      "ref": "sipp_1:EXA",
      "account": "sipp_1",
      "security_key": "EXA",
      "name": "Example Corp, Inc. Com Stk USD0.01",
      "series": "example_corp",
      "value_gbp": 15000.0,
      "weight": 0.09359462706940061,
      "return_ann": 0.17045162223818555,
      "volatility_ann": 0.11382352943030598,
      "sharpe": 1.1008813124527026,
      "history_months": 24,
      "status": "full"
    },
    {
      "ref": "sipp_1:EXG",
      "account": "sipp_1",
      "security_key": "EXG",
      "name": "Example Global Equity UCITS ETF USD Acc",
      "series": "global_equity",
      "value_gbp": 8456.79,
      "weight": 0.052767340416949096,
      "return_ann": 0.18760978439889908,
      "volatility_ann": 0.28805157650005064,
      "sharpe": 0.6038955128836598,
      "history_months": 24,
      "status": "full"
    },
    {
      "ref": "brokerage:EXC",
      "account": "brokerage",
      "security_key": "EXC",
      "name": "EXAMPLE CORP C CLASS A",
      "series": null,
      "value_gbp": 4950.0,
      "weight": 0.030886226932902203,
      "return_ann": null,
      "volatility_ann": null,
      "sharpe": null,
      "history_months": 0,
      "status": "missing"
    },
    {
      "ref": "pension:Example Target 2035 Fund - Accumulation",
      "account": "pension",
      "security_key": "Example Target 2035 Fund - Accumulation",
      "name": "Example Target 2035 Fund - Accumulation",
      "series": null,
      "value_gbp": 4210.9,
      "weight": 0.0262745076751026,
      "return_ann": null,
      "volatility_ann": null,
      "sharpe": null,
      "history_months": 0,
      "status": "missing"
    },
    {
      "ref": "brokerage:EXA",
      "account": "brokerage",
      "security_key": "EXA",
      "name": "EXAMPLE CORP A",
      "series": "example_corp",
      "value_gbp": 3768.75,
      "weight": 0.023515650051186904,
      "return_ann": 0.17045162223818555,
      "volatility_ann": 0.11382352943030598,
      "sharpe": 1.1008813124527026,
      "history_months": 24,
      "status": "full"
    }
  ],
  "exposure": {
    "available": true,
    "tables": {
      "asset_class": [
        {
          "label": "Unclassified",
          "value_gbp": 109283.9,
          "share": 0.6818923910126444
        },
        {
          "label": "equity",
          "value_gbp": 39705.54,
          "share": 0.24774834725927788
        },
        {
          "label": "bond",
          "value_gbp": 8320.0,
          "share": 0.051913819814494194
        },
        {
          "label": "cash",
          "value_gbp": 2956.17,
          "share": 0.01844544191358333
        }
      ],
      "sector": [
        {
          "label": "Unclassified",
          "value_gbp": 130083.9,
          "share": 0.81167694054888
        },
        {
          "label": "Information Technology",
          "value_gbp": 20882.95,
          "share": 0.13030211222482477
        },
        {
          "label": "Other",
          "value_gbp": 3382.72,
          "share": 0.021106936166779635
        },
        {
          "label": "Cash",
          "value_gbp": 2956.17,
          "share": 0.01844544191358333
        },
        {
          "label": "Financials",
          "value_gbp": 1268.52,
          "share": 0.007915101062542363
        },
        {
          "label": "Health Care",
          "value_gbp": 845.68,
          "share": 0.005276734041694909
        },
        {
          "label": "Industrials",
          "value_gbp": 845.68,
          "share": 0.005276734041694909
        }
      ],
      "region": [
        {
          "label": "Unclassified",
          "value_gbp": 109283.9,
          "share": 0.6818923910126444
        },
        {
          "label": "North America",
          "value_gbp": 30082.82,
          "share": 0.1877060462316276
        },
        {
          "label": "UK",
          "value_gbp": 8742.84,
          "share": 0.05455218683534165
        },
        {
          "label": "Other",
          "value_gbp": 6240.0,
          "share": 0.038935364860870646
        },
        {
          "label": "Cash",
          "value_gbp": 2956.17,
          "share": 0.01844544191358333
        },
        {
          "label": "Europe ex UK",
          "value_gbp": 1268.52,
          "share": 0.007915101062542363
        },
        {
          "label": "Emerging Markets",
          "value_gbp": 1268.52,
          "share": 0.007915101062542363
        },
        {
          "label": "Japan",
          "value_gbp": 422.84,
          "share": 0.0026383670208474544
        }
      ],
      "currency": [
        {
          "label": "Unclassified",
          "value_gbp": 109283.9,
          "share": 0.6818923910126444
        },
        {
          "label": "USD",
          "value_gbp": 31008.74,
          "share": 0.19348345537136755
        },
        {
          "label": "GBP",
          "value_gbp": 17013.09,
          "share": 0.10615558447005566
        },
        {
          "label": "EUR",
          "value_gbp": 1268.52,
          "share": 0.007915101062542363
        },
        {
          "label": "Other",
          "value_gbp": 1268.52,
          "share": 0.007915101062542363
        },
        {
          "label": "JPY",
          "value_gbp": 422.84,
          "share": 0.0026383670208474544
        }
      ]
    },
    "approximated_currency_share": 0.16987761753753658,
    "top_holdings": [
      {
        "name": "Example Corp",
        "value_gbp": 19107.02,
        "share": 0.11922097073726545
      },
      {
        "name": "Big Bank",
        "value_gbp": 126.85,
        "share": 0.0007915101062542364
      }
    ]
  },
  "performance": {
    "available": true,
    "metrics": {
      "months": 24,
      "annual_return": -0.013652158986675822,
      "annual_volatility": 0.0939609047284655,
      "sharpe": -0.5194871479413274,
      "max_drawdown": 0.13591594217327319,
      "peak": "2025-12",
      "trough": "2026-09",
      "recovery": null
    },
    "months": [
      {
        "month": "2024-10",
        "return": -0.03904528277702752,
        "wealth": 0.9609547172229724,
        "drawdown": 0.03904528277702757,
        "covered": 0.6924861172649579,
        "rolling_12m_return": null,
        "rolling_12m_volatility": null
      },
      {
        "month": "2024-11",